{
  "$schema": "https://fluidsbench.org/schemas/v1/submission.schema.json",
  "schema_version": "1.0",
  "submission_id": "windsorml-graph-u-net",
  "model": "Graph U-Net",
  "model_type": "GNN",
  "model_types": [
    "GNN"
  ],
  "training_regime": "from_scratch",
  "target_data_used": "official_train",
  "external_pretraining": false,
  "pretraining_data": [],
  "dataset": "WindsorML",
  "dataset_id": "windsorml",
  "dataset_version": "prototype-1",
  "split": "Default",
  "split_id": "default",
  "case_set_id": "default",
  "split_sha256": "cdc35549ce238c4e4f706203a83e602c9d0111b58aab34e8f4cd471346790fea",
  "parameter_count_millions": 14.11,
  "submitter_name": "Neil Ashton",
  "institution": "FluidsBench dummy data",
  "paper_url": "",
  "code_url": "",
  "submitted_at": "2024-07-27",
  "evaluation": {
    "reference_version": "prototype-1",
    "code_revision": "prototype-dummy-data",
    "command": "not-applicable (illustrative dummy data)",
    "evidence_file": "evaluation-evidence.json",
    "evidence_sha256": "82bdfef668234430d1c9d169df9d986ecea3d4518e0dda941cf23b7c24a59eef"
  },
  "approval": {
    "status": "prototype",
    "note": "Illustrative dummy data; not scientifically reviewed or approved."
  },
  "metric_values": {
    "surface_pressure_rel_l2": 14.8,
    "surface_pressure_rel_l1": 10.656,
    "surface_wall_shear_rel_l2": 24.2,
    "surface_wall_shear_rel_l1": 16.456,
    "volume_velocity_rel_l2": 15.5,
    "volume_velocity_rel_l1": 10.85,
    "volume_pressure_rel_l2": 18.4,
    "volume_pressure_rel_l1": 12.696,
    "cd_r2": 0.875,
    "cl_r2": 0.842,
    "velocity_profile_r2": 0.772,
    "cp_cut_r2": 0.786,
    "surface_pressure_mae": 63.9,
    "surface_pressure_rmse": 88.8,
    "surface_wall_shear_mae": 1.65,
    "surface_wall_shear_rmse": 2.42,
    "volume_velocity_mae": 3.8,
    "volume_velocity_rmse": 5.42,
    "volume_pressure_mae": 69.8,
    "volume_pressure_rmse": 101.2,
    "c_drag_mae": 0.0156,
    "c_lift_mae": 0.0293,
    "field_score": 0.39999999999999925,
    "force_score": 86.18,
    "diagnostic_score": 77.76,
    "overall_score": 41.185
  },
  "profile_data": {
    "format": "fluidsbench-profile-chunks-v1",
    "index_file": "profiles/index.json",
    "case_count": 1,
    "case_set_id": "default"
  },
  "note": "Illustrative WindsorML prototype row. AB-UPT v2 does not report WindsorML benchmark metrics; replace with evaluator outputs. Dummy JSON mirrors the existing generated placeholder profile curves so the frontend can load this row through the submission feed."
}
