{
  "$schema": "https://fluidsbench.org/schemas/v1/submission.schema.json",
  "schema_version": "1.0",
  "submission_id": "drivaerml-gino",
  "model": "GINO",
  "model_type": "Neural operator",
  "model_types": [
    "Neural operator"
  ],
  "training_regime": "from_scratch",
  "target_data_used": "official_train",
  "external_pretraining": false,
  "pretraining_data": [],
  "dataset": "DrivAerML",
  "dataset_id": "drivaerml",
  "dataset_version": "drivaerml-native-v3-candidate",
  "split": "Medium",
  "split_id": "medium",
  "case_set_id": "standard",
  "split_sha256": "8eb4fb53271a87114ad6ab42327741213ab93669fb74cebd023c46447c90356f",
  "parameter_count_millions": 15.6,
  "submitter_name": "Neil Ashton",
  "institution": "FluidsBench dummy data",
  "paper_url": "",
  "code_url": "",
  "submitted_at": "2025-06-13",
  "evaluation": {
    "reference_version": "drivaerml-evaluator-v3-candidate",
    "code_revision": "drivaerml-bounded-r2-prototype-v2",
    "command": "python3 scripts/generate_drivaerml_leaderboard_fixtures.py",
    "evidence_file": "evaluation-evidence.json",
    "evidence_sha256": "55dd8ea68abafe5187af169dbd135eab206a35f807a0011eb9a93946a55e5499"
  },
  "approval": {
    "status": "prototype",
    "note": "Realistic deterministic prototype fixture for the closed DrivAerML candidate; no metric or score is an approved model result."
  },
  "metric_values": {
    "overall_score": 21.30832524282,
    "field_score": 3.94,
    "force_score": 46.21138704804,
    "diagnostic_score": 31.14191392324,
    "surface_pressure_rel_l2": 13.03,
    "surface_pressure_equal_entity_rel_l2": 13.2906,
    "surface_wall_shear_rel_l2": 21.71,
    "surface_wall_shear_equal_entity_rel_l2": 22.1442,
    "volume_velocity_rel_l2": 40.58,
    "volume_pressure_rel_l2": 44.9,
    "drivaerml_surface_pressure_area_mae": 79.7,
    "drivaerml_surface_pressure_area_rmse": 110.8,
    "drivaerml_surface_pressure_equal_entity_mae": 81.294,
    "drivaerml_surface_pressure_equal_entity_rmse": 113.016,
    "drivaerml_surface_wall_shear_area_mae": 2.21,
    "drivaerml_surface_wall_shear_area_rmse": 3.26,
    "drivaerml_surface_wall_shear_equal_entity_mae": 2.2542,
    "drivaerml_surface_wall_shear_equal_entity_rmse": 3.3252,
    "drivaerml_volume_velocity_equal_entity_mae": 12.78,
    "drivaerml_volume_velocity_equal_entity_rmse": 18.26,
    "drivaerml_volume_pressure_equal_entity_mae": 232.4,
    "drivaerml_volume_pressure_equal_entity_rmse": 336.8,
    "field_integrated_cd_rmse": 0.0223,
    "field_integrated_cl_rmse": 0.0403,
    "field_integrated_cmpitch_rmse": 0.030225000000000002,
    "field_integrated_clf_rmse": 0.032240000000000005,
    "field_integrated_clr_rmse": 0.032240000000000005,
    "field_integrated_lift_closure_max_abs": 1e-07,
    "velocity_profile_uinf_rmse": 0.224253406383,
    "velocity_profile_experimental_subset_uinf_rmse": 0.231450263799,
    "cp_cut_rmse": 0.149457039941,
    "velocity_profile_r2": -0.19004720167,
    "cp_cut_r2": 0.778547848081,
    "cd_r2": 0.447028242052,
    "cl_r2": 0.500753522171,
    "c_pitch_r2": 0.468731104075
  },
  "profile_data": {
    "format": "fluidsbench-profile-chunks-v1",
    "index_file": "profiles/index.json",
    "case_count": 50,
    "case_set_id": "standard"
  },
  "note": "Deterministic analytical teaching fixture for the closed DrivAerML candidate. It contains smooth CFD-like predictions on all four continuous Cp-cut supports and the exact 3,756-point AutoCFD5 velocity grid for every official test case. The dimensional field errors retain the prototype calibration and the profile RMSE and R2 diagnostics are recomputed from the generated curves. Force R2 is derived from each prototype's existing RMSE and hash-bound official split truth statistics. The four score values use the published bounded-error and bounded-R2 transforms. This is not a native-field evaluation, approved result, ranking entry, or citable model claim."
}
