{
  "$schema": "https://fluidsbench.org/schemas/v1/submission.schema.json",
  "schema_version": "1.0",
  "submission_id": "vkils59-prototype-train-64",
  "model": "Transolver",
  "model_type": "Transformer",
  "model_types": [
    "Transformer"
  ],
  "training_regime": "from_scratch",
  "target_data_used": "official_train",
  "external_pretraining": false,
  "pretraining_data": [],
  "dataset": "VKI-LS59",
  "dataset_id": "vki-ls59",
  "dataset_version": "prototype-1",
  "split": "train_64",
  "split_id": "train_64",
  "case_set_id": "official_test",
  "split_sha256": "8dafe3a007cdc65b2fb974236e8e720b4b22d77d7d192147e21f3492900fcbd6",
  "parameter_count_millions": 8.2,
  "submitter_name": "Neil Ashton",
  "institution": "FluidsBench dummy data",
  "paper_url": "",
  "code_url": "",
  "submitted_at": "2026-07-15",
  "evaluation": {
    "reference_version": "prototype-1",
    "code_revision": "prototype-dummy-data",
    "command": "not-applicable (illustrative dummy data)",
    "evidence_file": "evaluation-evidence.json",
    "evidence_sha256": "5654266df8a709b1ccd86364a1695e890934f6ffcf8ce851144a1f3e28b0a922"
  },
  "approval": {
    "status": "prototype",
    "note": "Illustrative dummy data; not scientifically reviewed or approved."
  },
  "metric_values": {
    "vki_mach_rrmse": 0.04592,
    "vki_mach_rel_l2": 4.832,
    "vki_mach_rel_l1": 3.394,
    "vki_mach_r2": 0.9594,
    "vki_nut_rrmse": 0.098,
    "vki_nut_rel_l2": 10.449,
    "vki_nut_rel_l1": 7.484,
    "vki_nut_r2": 0.887,
    "vki_q_rrmse": 0.05264,
    "vki_q_rel_l2": 5.549,
    "vki_q_rel_l1": 3.907,
    "vki_q_r2": 0.9512,
    "vki_power_rrmse": 0.06048,
    "vki_power_rel_l2": 6.388,
    "vki_power_rel_l1": 4.511,
    "vki_power_r2": 0.9411,
    "vki_pr_rrmse": 0.03976,
    "vki_pr_rel_l2": 4.177,
    "vki_pr_rel_l1": 2.927,
    "vki_pr_r2": 0.9666,
    "vki_tr_rrmse": 0.03808,
    "vki_tr_rel_l2": 3.999,
    "vki_tr_rel_l1": 2.8,
    "vki_tr_r2": 0.9685,
    "vki_eth_is_rrmse": 0.04928,
    "vki_eth_is_rel_l2": 5.19,
    "vki_eth_is_rel_l1": 3.65,
    "vki_eth_is_r2": 0.9553,
    "vki_angle_out_rrmse": 0.05712,
    "vki_angle_out_rel_l2": 6.028,
    "vki_angle_out_rel_l1": 4.251,
    "vki_angle_out_r2": 0.9455,
    "total_error": 0.05516
  },
  "profile_data": {
    "format": "fluidsbench-profile-chunks-v1",
    "index_file": "profiles/index.json",
    "case_count": 168,
    "case_set_id": "official_test"
  },
  "note": "Illustrative dummy result for frontend and submission-pipeline testing. It is not a published benchmark result."
}
