{
  "$schema": "https://fluidsbench.org/schemas/v1/submission.schema.json",
  "schema_version": "1.0",
  "submission_id": "drivaerml-upt",
  "model": "UPT",
  "model_type": "Transformer",
  "model_types": [
    "Transformer"
  ],
  "training_regime": "from_scratch",
  "target_data_used": "official_train",
  "external_pretraining": false,
  "pretraining_data": [],
  "dataset": "DrivAerML",
  "dataset_id": "drivaerml",
  "dataset_version": "drivaerml-native-v2-candidate",
  "split": "Medium",
  "split_id": "medium",
  "case_set_id": "standard",
  "split_sha256": "8eb4fb53271a87114ad6ab42327741213ab93669fb74cebd023c46447c90356f",
  "parameter_count_millions": 10.98,
  "submitter_name": "Neil Ashton",
  "institution": "FluidsBench dummy data",
  "paper_url": "",
  "code_url": "",
  "submitted_at": "2025-06-13",
  "evaluation": {
    "reference_version": "drivaerml-evaluator-v2-candidate",
    "code_revision": "prototype-dummy-data",
    "command": "not-applicable (illustrative dummy data)",
    "evidence_file": "evaluation-evidence.json",
    "evidence_sha256": "6ccd7454db188378f36cd009f5b0e89372c43ea4098904dceadc9e40c7e5c670"
  },
  "approval": {
    "status": "prototype",
    "note": "Structural fixture for the closed DrivAerML candidate; no metric or score is an approved result."
  },
  "metric_values": {
    "overall_score": 0.0,
    "field_score": 0.0,
    "force_score": 0.0,
    "diagnostic_score": 0.0,
    "surface_pressure_rel_l2": 7.85,
    "surface_pressure_equal_entity_rel_l2": 7.536,
    "surface_wall_shear_rel_l2": 12.7,
    "surface_wall_shear_equal_entity_rel_l2": 12.192,
    "volume_velocity_rel_l2": 9.02,
    "volume_pressure_rel_l2": 10.54,
    "drivaerml_surface_pressure_area_mae": 48.0,
    "drivaerml_surface_pressure_area_rmse": 66.7,
    "drivaerml_surface_pressure_equal_entity_mae": 48.0,
    "drivaerml_surface_pressure_equal_entity_rmse": 66.7,
    "drivaerml_surface_wall_shear_area_mae": 1.3,
    "drivaerml_surface_wall_shear_area_rmse": 1.91,
    "drivaerml_surface_wall_shear_equal_entity_mae": 1.3,
    "drivaerml_surface_wall_shear_equal_entity_rmse": 1.91,
    "drivaerml_volume_velocity_equal_entity_mae": 2.84,
    "drivaerml_volume_velocity_equal_entity_rmse": 4.06,
    "drivaerml_volume_pressure_equal_entity_mae": 54.5,
    "drivaerml_volume_pressure_equal_entity_rmse": 79.0,
    "field_integrated_cd_rmse": 0.0062,
    "field_integrated_cl_rmse": 0.0128,
    "field_integrated_cmpitch_rmse": 0.009600000000000001,
    "field_integrated_clf_rmse": 0.01024,
    "field_integrated_clr_rmse": 0.01024,
    "field_integrated_lift_closure_max_abs": 1e-07,
    "velocity_profile_uinf_rmse": 0.30822070014844877,
    "velocity_profile_experimental_subset_uinf_rmse": 0.30822070014844877,
    "cp_probe_rmse": 0.3162277660168379,
    "cp_panel_macro_rmse": 0.3162277660168379
  },
  "profile_data": {
    "format": "fluidsbench-profile-chunks-v1",
    "index_file": "profiles/index.json",
    "case_count": 50,
    "case_set_id": "standard"
  },
  "note": "Illustrative structural fixture migrated to the official split IDs and candidate DrivAerML metric/profile vocabulary. It is not a recomputation from native fields. The four score values are zero placeholders because the nine physics-null denominators are not yet published, so this row is ineligible for ranking or citation."
}
