{
  "$schema": "https://fluidsbench.org/schemas/v1/submission.schema.json",
  "schema_version": "1.0",
  "submission_id": "drivaernetpp-ab-upt",
  "model": "AB-UPT",
  "model_type": "Transformer",
  "model_types": [
    "Transformer"
  ],
  "training_regime": "from_scratch",
  "target_data_used": "official_train",
  "external_pretraining": false,
  "pretraining_data": [],
  "dataset": "DrivAerNet++",
  "dataset_id": "drivaernetplusplus",
  "dataset_version": "prototype-1",
  "split": "Default",
  "split_id": "default",
  "case_set_id": "default",
  "split_sha256": "6ae0138c4ea9482f36592ed6064c37be44370134cc2b747f3fc8b735780d6334",
  "parameter_count_millions": 6.01,
  "submitter_name": "Neil Ashton",
  "institution": "FluidsBench dummy data",
  "paper_url": "",
  "code_url": "",
  "submitted_at": "2025-11-25",
  "evaluation": {
    "reference_version": "prototype-1",
    "code_revision": "prototype-dummy-data",
    "command": "not-applicable (illustrative dummy data)",
    "evidence_file": "evaluation-evidence.json",
    "evidence_sha256": "aa7a7b1c1277ba89dc54db1eeb7b05a60441afb1fd2b08d25ab6901878671854"
  },
  "approval": {
    "status": "prototype",
    "note": "Illustrative dummy data; not scientifically reviewed or approved."
  },
  "metric_values": {
    "overall_score": 86.0,
    "surface_pressure_rel_l2": 14.0,
    "surface_pressure_equal_entity_rel_l2": 13.58,
    "surface_pressure_rel_l1": 9.778,
    "surface_pressure_r2": 0.968
  },
  "profile_data": {
    "format": "fluidsbench-profile-chunks-v1",
    "index_file": "profiles/index.json",
    "case_count": 1,
    "case_set_id": "default"
  },
  "note": "CarBench Table 1 reports DrivAerNet++ surface-pressure Rel L2, pressure-field R2, and parameter count; force, volume, wall-shear, and profile metrics are placeholders until a DrivAerNet++ evaluator is available. Dummy JSON mirrors the existing generated placeholder profile curves so the frontend can load this row through the submission feed. Prototype dual-weight values are illustrative policy fixtures, not recomputations from public fields."
}
