{
  "$schema": "https://fluidsbench.org/schemas/v1/submission.schema.json",
  "schema_version": "1.0",
  "submission_id": "drivaerml-ab-upt",
  "model": "AB-UPT",
  "model_type": "Transformer",
  "model_types": [
    "Transformer"
  ],
  "training_regime": "from_scratch",
  "target_data_used": "official_train",
  "external_pretraining": false,
  "pretraining_data": [],
  "dataset": "DrivAerML",
  "dataset_id": "drivaerml",
  "dataset_version": "drivaerml-native-v3-candidate",
  "split": "Full",
  "split_id": "full",
  "case_set_id": "standard",
  "split_sha256": "8023cb3212c19b6039f7fb3fbd67b8c97d3514f9a3dce1cad6f88b2f3990f388",
  "parameter_count_millions": 8.75,
  "submitter_name": "Neil Ashton",
  "institution": "FluidsBench dummy data",
  "paper_url": "",
  "code_url": "",
  "submitted_at": "2025-06-13",
  "evaluation": {
    "reference_version": "drivaerml-evaluator-v3-candidate",
    "code_revision": "drivaerml-realistic-prototype-profiles-v1",
    "command": "python3 scripts/generate_drivaerml_leaderboard_fixtures.py",
    "evidence_file": "evaluation-evidence.json",
    "evidence_sha256": "b1412b90368adac2bddf1434f4c1bb6fe092b1c879dabc22b623b6e61ab93581"
  },
  "approval": {
    "status": "prototype",
    "note": "Realistic deterministic prototype fixture for the closed DrivAerML candidate; no metric or score is an approved model result."
  },
  "metric_values": {
    "overall_score": 0.0,
    "field_score": 0.0,
    "force_score": 0.0,
    "diagnostic_score": 0.0,
    "surface_pressure_rel_l2": 3.82,
    "surface_pressure_equal_entity_rel_l2": 3.82,
    "surface_wall_shear_rel_l2": 7.29,
    "surface_wall_shear_equal_entity_rel_l2": 7.29,
    "volume_velocity_rel_l2": 5.93,
    "volume_pressure_rel_l2": 6.08,
    "drivaerml_surface_pressure_area_mae": 23.4,
    "drivaerml_surface_pressure_area_rmse": 32.5,
    "drivaerml_surface_pressure_equal_entity_mae": 23.4,
    "drivaerml_surface_pressure_equal_entity_rmse": 32.5,
    "drivaerml_surface_wall_shear_area_mae": 0.74,
    "drivaerml_surface_wall_shear_area_rmse": 1.09,
    "drivaerml_surface_wall_shear_equal_entity_mae": 0.74,
    "drivaerml_surface_wall_shear_equal_entity_rmse": 1.09,
    "drivaerml_volume_velocity_equal_entity_mae": 1.87,
    "drivaerml_volume_velocity_equal_entity_rmse": 2.67,
    "drivaerml_volume_pressure_equal_entity_mae": 31.5,
    "drivaerml_volume_pressure_equal_entity_rmse": 45.6,
    "field_integrated_cd_rmse": 0.0012,
    "field_integrated_cl_rmse": 0.0037,
    "field_integrated_cmpitch_rmse": 0.002775,
    "field_integrated_clf_rmse": 0.0029600000000000004,
    "field_integrated_clr_rmse": 0.0029600000000000004,
    "field_integrated_lift_closure_max_abs": 1e-07,
    "velocity_profile_uinf_rmse": 0.0739214185,
    "velocity_profile_experimental_subset_uinf_rmse": 0.076212960848,
    "cp_cut_rmse": 0.042979346518
  },
  "profile_data": {
    "format": "fluidsbench-profile-chunks-v1",
    "index_file": "profiles/index.json",
    "case_count": 50,
    "case_set_id": "standard"
  },
  "note": "Deterministic analytical teaching fixture for the closed DrivAerML candidate. It contains smooth CFD-like predictions on all four continuous Cp-cut supports and the exact 3,756-point AutoCFD5 velocity grid for every official test case. The dimensional field errors retain the prototype calibration and the profile errors are recomputed from the generated curves. It is not a native-field evaluation, approved result, ranking entry, or citable model claim. The four score values remain zero because the nine physics-null denominators are not published."
}
