{
  "$schema": "https://fluidsbench.org/schemas/v1/submission.schema.json",
  "schema_version": "1.0",
  "submission_id": "drivaerml-graph-u-net",
  "model": "Graph U-Net",
  "model_type": "GNN",
  "model_types": [
    "GNN"
  ],
  "training_regime": "from_scratch",
  "target_data_used": "official_train",
  "external_pretraining": false,
  "pretraining_data": [],
  "dataset": "DrivAerML",
  "dataset_id": "drivaerml",
  "dataset_version": "prototype-1",
  "split": "Scarce",
  "split_id": "scarce",
  "case_set_id": "standard",
  "split_sha256": "f45abaebf8ef6c0076a5feb1cd39aeb438fcfc4f12ac260d012d166a63b05984",
  "parameter_count_millions": 14.11,
  "submitter_name": "Neil Ashton",
  "institution": "FluidsBench dummy data",
  "paper_url": "",
  "code_url": "",
  "submitted_at": "2025-06-13",
  "evaluation": {
    "reference_version": "prototype-1",
    "code_revision": "prototype-dummy-data",
    "command": "not-applicable (illustrative dummy data)",
    "evidence_file": "evaluation-evidence.json",
    "evidence_sha256": "685107549976ac5fb6b6f2ba2656bdc56c9ee8914690e154f41643570a03c443"
  },
  "approval": {
    "status": "prototype",
    "note": "Illustrative dummy data; not scientifically reviewed or approved."
  },
  "metric_values": {
    "surface_pressure_rel_l2": 16.13,
    "surface_pressure_rel_l1": 11.614,
    "surface_wall_shear_rel_l2": 27.85,
    "surface_wall_shear_rel_l1": 18.938,
    "volume_velocity_rel_l2": 17.98,
    "volume_velocity_rel_l1": 12.586,
    "volume_pressure_rel_l2": 20.52,
    "volume_pressure_rel_l1": 14.159,
    "cd_r2": 0.89,
    "cl_r2": 0.86,
    "velocity_profile_r2": 0.79,
    "cp_cut_r2": 0.805,
    "surface_pressure_mae": 98.7,
    "surface_pressure_rmse": 137.1,
    "surface_wall_shear_mae": 2.84,
    "surface_wall_shear_rmse": 4.18,
    "volume_velocity_mae": 5.66,
    "volume_velocity_rmse": 8.09,
    "volume_pressure_mae": 106.2,
    "volume_pressure_rmse": 153.9,
    "c_drag_mae": 0.0137,
    "c_lift_mae": 0.0257,
    "field_score": 0,
    "force_score": 87.80000000000001,
    "diagnostic_score": 79.6,
    "overall_score": 41.85
  },
  "profile_data": {
    "format": "fluidsbench-profile-chunks-v1",
    "index_file": "profiles/index.json",
    "case_count": 50,
    "case_set_id": "standard"
  },
  "note": "Baseline DrivAerML L2 metrics from AB-UPT v2 Table 7; L1 and profile R2 values are illustrative. Dummy JSON mirrors the existing generated placeholder profile curves so the frontend can load this row through the submission feed. The displayed split assignment is illustrative dummy data."
}
