{
  "$schema": "https://fluidsbench.org/schemas/v1/submission.schema.json",
  "schema_version": "1.0",
  "submission_id": "rotor37-prototype-train-1000",
  "model": "MeshGraphNets",
  "model_type": "GNN",
  "model_types": [
    "GNN"
  ],
  "training_regime": "from_scratch",
  "target_data_used": "official_train",
  "external_pretraining": false,
  "pretraining_data": [],
  "dataset": "Rotor37",
  "dataset_id": "rotor37",
  "dataset_version": "prototype-1",
  "split": "train_1000",
  "split_id": "train_1000",
  "case_set_id": "official_test",
  "split_sha256": "b802cedef6a86bfbd54e56e8a4762fb1038ad678add9e23ba6522d86e79373d6",
  "parameter_count_millions": 6.8,
  "submitter_name": "Neil Ashton",
  "institution": "FluidsBench dummy data",
  "paper_url": "",
  "code_url": "",
  "submitted_at": "2026-07-15",
  "evaluation": {
    "reference_version": "prototype-1",
    "code_revision": "prototype-dummy-data",
    "command": "not-applicable (illustrative dummy data)",
    "evidence_file": "evaluation-evidence.json",
    "evidence_sha256": "7da75b396715ee8d4094902538bfe2a20c7fa218301f9f2e51e0fa8e3e19bde6"
  },
  "approval": {
    "status": "prototype",
    "note": "Illustrative dummy data; not scientifically reviewed or approved."
  },
  "metric_values": {
    "rotor_density_rrmse": 0.01456,
    "rotor_density_rel_l2": 1.534,
    "rotor_density_rel_l1": 1.079,
    "rotor_density_r2": 0.9914,
    "rotor_density_mae": 0.0067,
    "rotor_density_rmse": 0.0093,
    "rotor_pressure_rrmse": 0.01792,
    "rotor_pressure_rel_l2": 1.894,
    "rotor_pressure_rel_l1": 1.339,
    "rotor_pressure_r2": 0.9886,
    "rotor_pressure_mae": 672,
    "rotor_pressure_rmse": 976,
    "rotor_temperature_rrmse": 0.01248,
    "rotor_temperature_rel_l2": 1.313,
    "rotor_temperature_rel_l1": 0.921,
    "rotor_temperature_r2": 0.993,
    "rotor_temperature_mae": 1.024,
    "rotor_temperature_rmse": 1.456,
    "rotor_massflow_rrmse": 0.01152,
    "rotor_massflow_rel_l2": 1.211,
    "rotor_massflow_rel_l1": 0.848,
    "rotor_massflow_r2": 0.9937,
    "rotor_massflow_mae": 0.1312,
    "rotor_massflow_rmse": 0.1824,
    "rotor_compression_ratio_rrmse": 0.01328,
    "rotor_compression_ratio_rel_l2": 1.398,
    "rotor_compression_ratio_rel_l1": 0.982,
    "rotor_compression_ratio_r2": 0.9924,
    "rotor_compression_ratio_mae": 0.005,
    "rotor_compression_ratio_rmse": 0.007,
    "rotor_efficiency_rrmse": 0.01536,
    "rotor_efficiency_rel_l2": 1.62,
    "rotor_efficiency_rel_l1": 1.141,
    "rotor_efficiency_r2": 0.9907,
    "rotor_efficiency_mae": 0.003,
    "rotor_efficiency_rmse": 0.0043,
    "total_error": 0.01419
  },
  "profile_data": {
    "format": "fluidsbench-profile-chunks-v1",
    "index_file": "profiles/index.json",
    "case_count": 200,
    "case_set_id": "official_test"
  },
  "note": "Illustrative dummy result for frontend and submission-pipeline testing. It is not a published benchmark result."
}
