{
  "$schema": "https://fluidsbench.org/schemas/v1/submission.schema.json",
  "schema_version": "1.0",
  "submission_id": "airfrans-mlp-full",
  "model": "MLP",
  "model_type": "MLP",
  "model_types": [
    "MLP"
  ],
  "training_regime": "from_scratch",
  "target_data_used": "official_train",
  "external_pretraining": false,
  "pretraining_data": [],
  "dataset": "AirfRANS",
  "dataset_id": "airfrans",
  "dataset_version": "prototype-1",
  "split": "AoA extrapolation",
  "split_id": "aoa_extrapolation",
  "case_set_id": "aoa_extrapolation",
  "split_sha256": "58621bbd012d3d14f45f49783696ddb4f03766bd2db144624c2d77711b17961b",
  "parameter_count_millions": 0.02,
  "submitter_name": "Neil Ashton",
  "institution": "FluidsBench dummy data",
  "paper_url": "",
  "code_url": "",
  "submitted_at": "2023-06-01",
  "evaluation": {
    "reference_version": "airfrans-scoring-v2-candidate",
    "code_revision": "prototype-dummy-data",
    "command": "not-applicable (illustrative dummy data)",
    "evidence_file": "evaluation-evidence.json",
    "evidence_sha256": "0805b7c9aa2c0ee4dc2ccee7c6a0f5926f1250c8899727a2376e36563b2d35ee"
  },
  "approval": {
    "status": "prototype",
    "note": "Illustrative dummy data; not scientifically reviewed or approved."
  },
  "metric_values": {
    "overall_score": 61.67166666666667,
    "surface_pressure_rel_l2": 33.62,
    "surface_pressure_rel_l1": 24.206,
    "surface_wall_shear_rel_l2": 4.29,
    "surface_wall_shear_rel_l1": 2.917,
    "flow_domain_velocity_rel_l2": 9.82,
    "flow_domain_velocity_rel_l1": 6.874,
    "flow_domain_pressure_rel_l2": 8.6,
    "flow_domain_pressure_rel_l1": 5.934,
    "cd_r2": 0.957,
    "cl_r2": 0.992,
    "velocity_profile_r2": 0.902,
    "c_drag_mae": 0.0058,
    "c_lift_mae": 0.0017,
    "field_score": 29.693333333333335,
    "force_score": 97.10000000000001,
    "diagnostic_score": 90.2,
    "surface_pressure_equal_entity_rel_l2": 31.939,
    "surface_wall_shear_equal_entity_rel_l2": 4.0755,
    "flow_domain_velocity_physical_rel_l2": 10.336842,
    "flow_domain_pressure_physical_rel_l2": 9.052632
  },
  "profile_data": {
    "format": "fluidsbench-profile-chunks-v1",
    "index_file": "profiles/index.json",
    "case_count": 196,
    "case_set_id": "aoa_extrapolation"
  },
  "note": "AirfRANS full-data baseline from the arXiv v3 benchmark tables. Field columns are prototype conversions from normalized MSE values; force R2 columns are placeholders derived from force relative-error comparisons until a dimensional FluidsBench evaluator is available. Dummy JSON mirrors the existing generated placeholder profile curves so the frontend can load this row through the submission feed. The displayed split assignment is illustrative dummy data. Prototype dual-weight values are illustrative policy fixtures, not recomputations from public fields.",
  "methodology": {
    "format": "fluidsbench-method-v1",
    "record_kind": "prototype_fixture",
    "record_note": "Leaderboard interface fixture only. The model name, broad family, and nominal parameter count mirror the prototype row; component breakdown, hyperparameters, training run, checkpoint, and timing were not submitted or independently verified. This record must not be cited as the authors' methodology.",
    "architecture": {
      "description": "MLP prototype row (MLP). Pointwise multilayer-perceptron family. The repository does not contain a verified layer-by-layer configuration, so the nominal parameter count is represented as one aggregate component.",
      "total_parameter_count": 20000,
      "parameter_count_basis": "rounded_from_reported_millions",
      "submitter_trainable_parameter_count": 0,
      "components": [
        {
          "id": "prototype-surrogate",
          "family": "MLP",
          "role": "Prototype airfrans field predictor.",
          "description": "Aggregate placeholder for the named MLP architecture. Pointwise multilayer-perceptron family. No unverified internal split is invented.",
          "parameter_count": 20000
        }
      ],
      "key_hyperparameters": [
        {
          "id": "reported-model-variant",
          "component_ids": [
            "prototype-surrogate"
          ],
          "name": "reported_model_variant",
          "value": "MLP",
          "description": "Only the named prototype model variant is recorded; exact depth, width, attention, neighborhood, and optimizer settings were not encoded in this dummy submission."
        }
      ],
      "input_features": [
        {
          "id": "native-geometry",
          "component_ids": [
            "prototype-surrogate"
          ],
          "name": "native_geometry_coordinates",
          "domain": "mesh",
          "component_count": 2,
          "description": "2D geometry or mesh coordinates associated with the dataset's official supports. Exact feature engineering was not recorded for this prototype row."
        }
      ],
      "predicted_fields": [
        {
          "field_id": "two-dimensional-domain-native.U",
          "domain": "domain",
          "component_count": 2,
          "component_ids": [
            "prototype-surrogate"
          ],
          "production": "direct_model_output",
          "description": "Prototype declaration for Cartesian velocity on every official two-dimensional flow-domain point. The fixture does not retain executable predictions proving whether the named architecture produced this quantity directly."
        },
        {
          "field_id": "two-dimensional-domain-native.p",
          "domain": "domain",
          "component_count": 1,
          "component_ids": [
            "prototype-surrogate"
          ],
          "production": "direct_model_output",
          "description": "Prototype declaration for Kinematic pressure on every official two-dimensional flow-domain point. The fixture does not retain executable predictions proving whether the named architecture produced this quantity directly."
        },
        {
          "field_id": "airfoil-curve-native.p",
          "domain": "curve",
          "component_count": 1,
          "component_ids": [
            "prototype-surrogate"
          ],
          "production": "direct_model_output",
          "description": "Prototype declaration for Kinematic pressure on the official airfoil boundary curve; this may be derived by selecting the corresponding model output. The fixture does not retain executable predictions proving whether the named architecture produced this quantity directly."
        }
      ]
    },
    "data_handling": {
      "normalization": "Not recorded for this prototype fixture; no normalization statistics are asserted.",
      "preprocessing": "Not recorded for this prototype fixture; no remeshing or feature construction procedure is asserted.",
      "sampling": "Not recorded for this prototype fixture; the leaderboard's dummy coverage must not be interpreted as the named model's sampling policy."
    },
    "training": {
      "stages": [
        {
          "id": "prototype-training-not-recorded",
          "status": "prototype_not_recorded",
          "component_ids": [
            "prototype-surrogate"
          ],
          "description": "No executable training run, optimizer configuration, random seed, or training-compute receipt accompanies this dummy row."
        }
      ]
    },
    "checkpoints": [],
    "inference_compute": {
      "status": "not_measured",
      "reason": "The prototype leaderboard row was not produced by a retained model checkpoint, so end-to-end inference time and hardware are unavailable."
    }
  }
}
