{
  "$schema": "https://fluidsbench.org/schemas/v1/submission.schema.json",
  "schema_version": "1.0",
  "submission_id": "drivaernetpp-transolver",
  "model": "Transolver",
  "model_type": "Transformer",
  "model_types": [
    "Transformer"
  ],
  "training_regime": "from_scratch",
  "target_data_used": "official_train",
  "external_pretraining": false,
  "pretraining_data": [],
  "dataset": "DrivAerNet++",
  "dataset_id": "drivaernetplusplus",
  "dataset_version": "prototype-1",
  "split": "Default",
  "split_id": "default",
  "case_set_id": "default",
  "split_sha256": "6ae0138c4ea9482f36592ed6064c37be44370134cc2b747f3fc8b735780d6334",
  "parameter_count_millions": 2.47,
  "submitter_name": "Neil Ashton",
  "institution": "FluidsBench dummy data",
  "paper_url": "",
  "code_url": "",
  "submitted_at": "2025-11-25",
  "evaluation": {
    "reference_version": "prototype-1",
    "code_revision": "prototype-dummy-data",
    "command": "not-applicable (illustrative dummy data)",
    "evidence_file": "evaluation-evidence.json",
    "evidence_sha256": "d92b9d17ab3add70cd9bb3dedc0fe4b166c5bcc344c7e8bf142b9c9dbccf3965"
  },
  "approval": {
    "status": "prototype",
    "note": "Illustrative dummy data; not scientifically reviewed or approved."
  },
  "metric_values": {
    "surface_pressure_rel_l2": 15.03,
    "surface_pressure_rel_l1": 10.822,
    "surface_wall_shear_rel_l2": 18.79,
    "surface_wall_shear_rel_l1": 12.777,
    "volume_velocity_rel_l2": 17.28,
    "volume_velocity_rel_l1": 12.096,
    "volume_pressure_rel_l2": 15.78,
    "volume_pressure_rel_l1": 10.888,
    "cd_r2": 0.958,
    "cl_r2": 0.958,
    "velocity_profile_r2": 0.928,
    "cp_cut_r2": 0.958,
    "surface_pressure_mae": 86.6,
    "surface_pressure_rmse": 120.2,
    "surface_wall_shear_mae": 1.79,
    "surface_wall_shear_rmse": 2.63,
    "volume_velocity_mae": 5.08,
    "volume_velocity_rmse": 7.26,
    "volume_pressure_mae": 76.2,
    "volume_pressure_rmse": 110.5,
    "c_drag_mae": 0.0053,
    "c_lift_mae": 0.0082,
    "field_score": 1.21,
    "force_score": 95.8,
    "diagnostic_score": 94,
    "overall_score": 48.055
  },
  "profile_data": {
    "format": "fluidsbench-profile-chunks-v1",
    "index_file": "profiles/index.json",
    "case_count": 1,
    "case_set_id": "default"
  },
  "note": "CarBench Table 1 reports DrivAerNet++ surface-pressure Rel L2, pressure-field R2, and parameter count; force, volume, wall-shear, and profile metrics are placeholders until a DrivAerNet++ evaluator is available. Dummy JSON mirrors the existing generated placeholder profile curves so the frontend can load this row through the submission feed."
}
