{
  "$schema": "https://fluidsbench.org/schemas/v1/submission.schema.json",
  "schema_version": "1.0",
  "submission_id": "dummy-drivaerml-meshoperator-v1",
  "model": "MeshGraphNets",
  "model_type": "GNN",
  "model_types": [
    "GNN"
  ],
  "training_regime": "pretrained_official_train",
  "target_data_used": "official_train",
  "external_pretraining": true,
  "pretraining_data": [
    {
      "name": "Example external geometry-flow corpus",
      "type": "CFD simulations",
      "public": false,
      "samples": "TODO",
      "notes": "Dummy metadata showing external pretraining followed by use of the official benchmark training split."
    }
  ],
  "dataset": "DrivAerML",
  "dataset_id": "drivaerml",
  "dataset_version": "prototype-1",
  "split": "Geometry",
  "split_id": "geometry",
  "case_set_id": "geometry",
  "split_sha256": "06e436cb3e77ea777ab4fef029ad907f89211a65628c632dd5244d7fad5795c1",
  "parameter_count_millions": 18.7,
  "submitter_name": "Neil Ashton",
  "institution": "AeroAI Ltd",
  "paper_url": "https://example.com/meshoperator-plus",
  "code_url": "https://github.com/example/meshoperator-plus",
  "submitted_at": "2026-07-08",
  "evaluation": {
    "reference_version": "prototype-1",
    "code_revision": "prototype-dummy-data",
    "command": "not-applicable (illustrative dummy data)",
    "evidence_file": "evaluation-evidence.json",
    "evidence_sha256": "9ce868708fad04ecb3fcf4dbd07d913dbe7d9fa2a8959c759dc416a4611dd4f3"
  },
  "approval": {
    "status": "prototype",
    "note": "Illustrative dummy data; not scientifically reviewed or approved."
  },
  "metric_values": {
    "surface_pressure_rel_l2": 3.08,
    "surface_pressure_rel_l1": 2.15,
    "surface_wall_shear_rel_l2": 4.18,
    "surface_wall_shear_rel_l1": 2.84,
    "volume_velocity_rel_l2": 2.04,
    "volume_velocity_rel_l1": 1.43,
    "volume_pressure_rel_l2": 2.42,
    "volume_pressure_rel_l1": 1.67,
    "cd_r2": 0.991,
    "cl_r2": 0.982,
    "velocity_profile_r2": 0.978,
    "cp_cut_r2": 0.973,
    "surface_pressure_mae": 18.3,
    "surface_pressure_rmse": 26.2,
    "surface_wall_shear_mae": 0.43,
    "surface_wall_shear_rmse": 0.63,
    "volume_velocity_mae": 0.64,
    "volume_velocity_rmse": 0.92,
    "volume_pressure_mae": 12.5,
    "volume_pressure_rmse": 18.1,
    "c_drag_mae": 0.0019,
    "c_lift_mae": 0.004,
    "field_score": 81.33333333333334,
    "force_score": 98.74000000000001,
    "diagnostic_score": 97.6,
    "overall_score": 89.75166666666667,
    "surface_pressure_equal_entity_rel_l2": 2.9876,
    "surface_wall_shear_equal_entity_rel_l2": 4.0546,
    "volume_velocity_physical_rel_l2": 2.103093,
    "volume_pressure_physical_rel_l2": 2.494845
  },
  "profile_data": {
    "format": "fluidsbench-profile-chunks-v1",
    "index_file": "profiles/index.json",
    "case_count": 97,
    "case_set_id": "geometry"
  },
  "note": "Dummy DrivAerML submission with compact profile curves. The displayed split assignment is illustrative dummy data. Prototype dual-weight values are illustrative policy fixtures, not recomputations from public fields."
}
